{
  "schemaVersion": 2,
  "definitionVersion": 2,
  "taskId": "TASK-20260925-TEST-FIX",
  "scale": "medium",
  "status": "done",
  "goal": {
    "objective": "修复已证实测试失败",
    "scope": [
      "同步恢复原子保全",
      "重建测试隔离"
    ],
    "completionCriteria": [
      "TC04-30及异常回归通过",
      "桌面类型及构建通过",
      "Maven默认测试通过"
    ]
  },
  "revision": {
    "design": "v1",
    "code": "v1"
  },
  "exitCriteria": [
    {
      "id": "DESIGN",
      "status": "done",
      "dependsOn": [],
      "by": "root",
      "executionKind": "direct",
      "executionId": "root-DESIGN",
      "evidenceRef": ".ai/docs/20260925-test-fix/design.md",
      "validatedRevision": "v1",
      "completedAt": "2026-09-25T03:01:26.214843+00:00",
      "confirmationRequired": false
    },
    {
      "id": "TESTCASES",
      "status": "done",
      "dependsOn": [
        "DESIGN"
      ],
      "by": "root",
      "executionKind": "direct",
      "executionId": "root-TESTCASES",
      "evidenceRef": ".ai/docs/20260925-test-fix/design.md",
      "validatedRevision": "v1",
      "completedAt": "2026-09-25T03:01:26.214843+00:00",
      "confirmationRequired": false
    },
    {
      "id": "IMPLEMENTED",
      "status": "done",
      "dependsOn": [
        "DESIGN",
        "TESTCASES"
      ],
      "by": "root",
      "executionKind": "direct",
      "executionId": "root-IMPLEMENTED",
      "evidenceRef": ".ai/docs/20260925-test-fix/results.md",
      "validatedRevision": "v1",
      "completedAt": "2026-09-25T03:01:26.214843+00:00",
      "confirmationRequired": false
    },
    {
      "id": "CODE_REVIEW",
      "status": "done",
      "dependsOn": [
        "IMPLEMENTED"
      ],
      "by": "root",
      "executionKind": "direct",
      "executionId": "root-CODE_REVIEW",
      "evidenceRef": ".ai/docs/20260925-test-fix/results.md",
      "validatedRevision": "v1",
      "completedAt": "2026-09-25T03:01:26.214843+00:00",
      "confirmationRequired": false
    },
    {
      "id": "SECURITY_REVIEW",
      "status": "done",
      "dependsOn": [
        "IMPLEMENTED"
      ],
      "by": "root",
      "executionKind": "direct",
      "executionId": "root-SECURITY_REVIEW",
      "evidenceRef": ".ai/docs/20260925-test-fix/results.md",
      "validatedRevision": "v1",
      "completedAt": "2026-09-25T03:01:26.214843+00:00",
      "confirmationRequired": false
    },
    {
      "id": "TEST_PASS",
      "status": "done",
      "dependsOn": [
        "CODE_REVIEW",
        "SECURITY_REVIEW"
      ],
      "by": "root",
      "executionKind": "direct",
      "executionId": "root-TEST_PASS",
      "evidenceRef": ".ai/docs/20260925-test-fix/results.md",
      "validatedRevision": "v1",
      "completedAt": "2026-09-25T03:01:26.214843+00:00",
      "confirmationRequired": false
    },
    {
      "id": "KNOWLEDGE",
      "status": "done",
      "dependsOn": [
        "TEST_PASS"
      ],
      "by": "root",
      "executionKind": "direct",
      "executionId": "root-KNOWLEDGE",
      "evidenceRef": ".ai/docs/20260925-test-fix/results.md",
      "validatedRevision": "v1",
      "completedAt": "2026-09-25T03:01:26.214843+00:00",
      "confirmationRequired": false
    },
    {
      "id": "ACCEPT",
      "status": "done",
      "dependsOn": [
        "KNOWLEDGE"
      ],
      "by": "root",
      "executionKind": "direct",
      "executionId": "root-ACCEPT",
      "evidenceRef": ".ai/docs/20260925-test-fix/results.md",
      "validatedRevision": "v1",
      "completedAt": "2026-09-25T03:01:26.214843+00:00",
      "confirmationRequired": false
    }
  ],
  "artifacts": {
    "design": {
      "status": "done",
      "ref": ".ai/docs/20260925-test-fix/design.md"
    },
    "results": {
      "status": "done",
      "ref": ".ai/docs/20260925-test-fix/results.md"
    },
    "testcases.md": {
      "status": "done",
      "ref": ".ai/docs/20260925-test-fix/testcases.md"
    },
    "changereport.md": {
      "status": "done",
      "ref": ".ai/docs/20260925-test-fix/changereport.md"
    },
    "codereview.md": {
      "status": "done",
      "ref": ".ai/docs/20260925-test-fix/codereview.md"
    },
    "security.md": {
      "status": "done",
      "ref": ".ai/docs/20260925-test-fix/security.md"
    },
    "testreport.md": {
      "status": "done",
      "ref": ".ai/docs/20260925-test-fix/testreport.md"
    }
  },
  "blockers": [],
  "acceptanceEvidence": [
    {
      "criterion": "TC04-30及异常回归通过",
      "evidenceRef": ".ai/docs/20260925-test-fix/results.md",
      "validatedRevision": "v1"
    },
    {
      "criterion": "桌面类型及构建通过",
      "evidenceRef": ".ai/docs/20260925-test-fix/results.md",
      "validatedRevision": "v1"
    },
    {
      "criterion": "Maven默认测试通过",
      "evidenceRef": ".ai/docs/20260925-test-fix/results.md",
      "validatedRevision": "v1"
    }
  ],
  "dispatchLedger": [],
  "singleAgentAuthorization": {
    "taskId": "TASK-20260925-TEST-FIX",
    "actor": "root",
    "authorizedBy": "user",
    "authorizationQuote": "不要开子线程，你自己完成",
    "evidenceRef": ".ai/tasks/TASK-20260925-TEST-FIX.md",
    "criteria": [
      "CODE_REVIEW",
      "SECURITY_REVIEW",
      "TEST_PASS",
      "ACCEPT"
    ]
  },
  "history": [
    {
      "eventId": "test-fix-complete",
      "action": "主线程按用户授权自检并验收本次失败修复",
      "actor": "root",
      "occurredAt": "2026-09-25T03:01:26.214843+00:00",
      "revision": {
        "design": "v1",
        "code": "v1"
      }
    }
  ]
}